{
  "schema_version": 1,
  "company": "Microsoft Corporation",
  "scope": "2023 to 2025 fiscal annual reports; bounded live research",
  "title": "What the company put on record",
  "deck": "Source-backed statements from annual reports. Dates, attribution and interpretation remain subject to review.",
  "as_of": "2026-10-01",
  "review": "Live research; proposed interpretation. No management credibility score.",
  "source_documents": 3,
  "extracted_claims": 107,
  "ledger_entries": 15,
  "uncurated_claims": 92,
  "claim_count_is_quality_score": false,
  "coverage": [
    {
      "year": 2023,
      "collector_excerpts": 41,
      "status": "partial collection; review pending"
    },
    {
      "year": 2024,
      "collector_excerpts": 41,
      "status": "partial collection; review pending"
    },
    {
      "year": 2025,
      "collector_excerpts": 25,
      "status": "partial collection; review pending"
    }
  ],
  "collection_gaps": [
    "FY2023: 1 claims had unsupported quotations or page numbers and were rejected.",
    "FY2023: 1 claims had unsupported quotations or page numbers and were rejected.",
    "FY2023: 2 claims had unsupported quotations or page numbers and were rejected.",
    "FY2024: Publication date for Microsoft 2024 Annual Report not explicitly stated in source.",
    "FY2024: Publication date (filing date) for SEC Form 10-K not explicitly stated in source.",
    "FY2024: 2 claims had unsupported quotations or page numbers and were rejected.",
    "FY2024: No explicit Management’s Discussion and Analysis (MD&A) section was identified in the provided chunk.",
    "FY2024: 2 claims had unsupported quotations or page numbers and were rejected.",
    "FY2024: 3 claims had unsupported quotations or page numbers and were rejected.",
    "FY2025: MD&A section not present in the provided chunk.",
    "FY2025: The provided chunk does not contain an MD&A (Management's Discussion and Analysis) section; it consists of financial statements and notes only.",
    "FY2025: 1 claims had unsupported quotations or page numbers and were rejected."
  ],
  "limitations": [
    "Three fiscal years and one annual report per year are attempted; coverage is not exhaustive.",
    "Up to six text chunks and ten candidate claims per chunk are analyzed. Five milestones per report are selected.",
    "Exact quotation presence is checked. Metadata, classification and semantic accuracy require human review.",
    "No director contribution, promise fulfillment or challenge resolution has been established.",
    "Source text and SHA-256 fingerprints are retained privately for seven days; original PDF/HTML bytes are not retained.",
    "Timeline positions use report period ends. They must not be read as exact decision dates."
  ],
  "assessments": [
    {
      "id": "promises",
      "refs": [
        "fy2025-claim-13",
        "fy2025-claim-14"
      ],
      "meaning": "Evidence inventory, not a management-quality score.",
      "limit": "Targets and aspirations are recorded without concluding delivery.",
      "review_status": "Human review required",
      "reference_roles": {
        "fy2025-claim-13": [
          "source statement"
        ],
        "fy2025-claim-14": [
          "source statement"
        ]
      },
      "date_support": [],
      "name": "Management promises",
      "value": "Evidence collected",
      "summary": "2 selected source statements. Interpretation remains open.",
      "caption": "Review source evidence"
    },
    {
      "id": "outcomes",
      "refs": [
        "fy2023-claim-0",
        "fy2023-claim-1",
        "fy2023-claim-2",
        "fy2023-claim-3",
        "fy2023-claim-4",
        "fy2024-claim-5",
        "fy2024-claim-6",
        "fy2024-claim-7",
        "fy2024-claim-8",
        "fy2024-claim-9",
        "fy2025-claim-10",
        "fy2025-claim-11",
        "fy2025-claim-12"
      ],
      "meaning": "Evidence inventory, not a management-quality score.",
      "limit": "Reported facts have not been matched to prior promises or independently audited.",
      "review_status": "Human review required",
      "reference_roles": {
        "fy2023-claim-0": [
          "source statement"
        ],
        "fy2023-claim-1": [
          "source statement"
        ],
        "fy2023-claim-2": [
          "source statement"
        ],
        "fy2023-claim-3": [
          "source statement"
        ],
        "fy2023-claim-4": [
          "source statement"
        ],
        "fy2024-claim-5": [
          "source statement"
        ],
        "fy2024-claim-6": [
          "source statement"
        ],
        "fy2024-claim-7": [
          "source statement"
        ],
        "fy2024-claim-8": [
          "source statement"
        ],
        "fy2024-claim-9": [
          "source statement"
        ],
        "fy2025-claim-10": [
          "source statement"
        ],
        "fy2025-claim-11": [
          "source statement"
        ],
        "fy2025-claim-12": [
          "source statement"
        ]
      },
      "date_support": [],
      "name": "Reported performance",
      "value": "Evidence collected",
      "summary": "13 selected source statements. Interpretation remains open.",
      "caption": "Review source evidence"
    },
    {
      "id": "outlook",
      "refs": [
        "fy2023-claim-0"
      ],
      "meaning": "Evidence inventory, not a management-quality score.",
      "limit": "Forecasts are uncertain and are not treated as achieved outcomes.",
      "review_status": "Human review required",
      "reference_roles": {
        "fy2023-claim-0": [
          "scope context only"
        ]
      },
      "date_support": [],
      "name": "Forward outlook",
      "value": "Not assessed",
      "summary": "No selected statement supports an assessment of this area.",
      "caption": "Review scope and limits"
    },
    {
      "id": "challenges",
      "refs": [
        "fy2023-claim-0"
      ],
      "meaning": "Evidence inventory, not a management-quality score.",
      "limit": "A reported challenge does not establish responsibility, resolution or personal conduct.",
      "review_status": "Human review required",
      "reference_roles": {
        "fy2023-claim-0": [
          "scope context only"
        ]
      },
      "date_support": [],
      "name": "Management challenges",
      "value": "Not assessed",
      "summary": "No selected statement supports an assessment of this area.",
      "caption": "Review scope and limits"
    }
  ],
  "events": [
    {
      "id": "fy2023-claim-0",
      "refs": [
        "fy2023-claim-0"
      ],
      "meaning": "Microsoft reported record revenue of $211 billion in FY23.",
      "limit": "The timeline date is the report period end, not a verified statement or decision date. No promise-to-outcome comparison or individual contribution has been verified.",
      "review_status": "Proposed interpretation; human review required",
      "reference_roles": {
        "fy2023-claim-0": [
          "source statement"
        ]
      },
      "date_support": [
        {
          "entry": "fy2023-claim-0",
          "role": "report_period_end",
          "value": "2023-06-30",
          "basis": "Agent-reported document metadata; not an independently verified statement date"
        }
      ],
      "month": "2023-06",
      "date": "FY2023",
      "date_kind": "Report period end",
      "type": "reported fact",
      "owner": "Microsoft",
      "decision_by": "unknown",
      "title": "Microsoft reported record revenue of $211 billion in FY23.",
      "summary": "we delivered strong results in fiscal year 2023, including a record $211 billion in revenue and over $88 billion in operating income.",
      "tile": "211",
      "label": "billion USD",
      "target_period": null
    },
    {
      "id": "fy2023-claim-1",
      "refs": [
        "fy2023-claim-1"
      ],
      "meaning": "Over 11,000 organizations use Azure OpenAI Service.",
      "limit": "The timeline date is the report period end, not a verified statement or decision date. No promise-to-outcome comparison or individual contribution has been verified.",
      "review_status": "Proposed interpretation; human review required",
      "reference_roles": {
        "fy2023-claim-1": [
          "source statement"
        ]
      },
      "date_support": [
        {
          "entry": "fy2023-claim-1",
          "role": "report_period_end",
          "value": "2023-06-30",
          "basis": "Agent-reported document metadata; not an independently verified statement date"
        }
      ],
      "month": "2023-06",
      "date": "FY2023",
      "date_kind": "Report period end",
      "type": "reported fact",
      "owner": "Microsoft",
      "decision_by": "unknown",
      "title": "Over 11,000 organizations use Azure OpenAI Service.",
      "summary": "More than 11,000 organizations across industries are already using it for advanced scenarios like content and code generation.",
      "tile": "11000",
      "label": "organizations",
      "target_period": null
    },
    {
      "id": "fy2023-claim-2",
      "refs": [
        "fy2023-claim-2"
      ],
      "meaning": "GitHub annual recurring revenue exceeded $1 billion in FY23.",
      "limit": "The timeline date is the report period end, not a verified statement or decision date. No promise-to-outcome comparison or individual contribution has been verified.",
      "review_status": "Proposed interpretation; human review required",
      "reference_roles": {
        "fy2023-claim-2": [
          "source statement"
        ]
      },
      "date_support": [
        {
          "entry": "fy2023-claim-2",
          "role": "report_period_end",
          "value": "2023-06-30",
          "basis": "Agent-reported document metadata; not an independently verified statement date"
        }
      ],
      "month": "2023-06",
      "date": "FY2023",
      "date_kind": "Report period end",
      "type": "reported fact",